article_id,url,title,content,bias
0,https://reason.com/2024/11/07/what-if-anything-will-democrats-learn-from-this-election,"What, If Anything, Will Democrats Learn From This Election?","Votes are still left to be counted, but it is clear by now that former President Donald Trump is once again the president-elect, prevailing over Vice President Kamala Harris in not only the Electoral College but also the popular vote. This marks not only the first time he has ever come close to majority support, but also only the second time since the end of the Cold War that a Republican presidential candidate has won the popular vote.

""Of the counties with nearly complete results, more than 90 percent shifted in favor of former President Donald J. Trump in the 2024 presidential election,"" The New York Times found on the morning after the election. ""Early results showed that even a number of states where Vice President Kamala Harris was ahead had shifted right.""

""Trump picked up more votes in every state apart from Utah and Washington,"" added the Financial Times. ""Across the US, the data suggests women, urban voters and the Latino vote did not come through for Harris, while rural areas came out strong for Trump.""

With the U.S. Senate also lost and the House very much in peril, Democrats may find themselves in the wilderness yet again. But what lessons will they take from this experience in electoral repudiation? For that matter, will they learn anything?

It's not a foregone conclusion that they will: In the three elections in which Trump has competed, Democrats largely treated him as an existential threat, making a case for his inherent unfitness for office but often forgetting to mount a positive campaign for themselves. And then, after losing to him in 2016—even after beating him in 2020—the party did no apparent soul-searching to determine why voters would pick such an unfit candidate.

Ironically, it's a lesson they could learn from Republicans. In 2012, after losing two presidential elections in a row, Republicans conducted a ""full autopsy"" on the moribund party and its electoral failures, hoping to determine how to appeal to voters going forward. To compile the report, which was released the following year, the panel conducted conference calls, online surveys, focus groups, and more than 3,000 ""group listening sessions.""

Democrats, on the other hand, did no such self-inquiry when Trump defeated Hillary Clinton in 2016. ""Democrats didn't even attempt to do an autopsy in the wake of 2016, relegating debates about the party's future to places like Twitter and cable news,"" wrote Jon Favreau, a progressive commentator and former speechwriter for President Barack Obama.

That may not be entirely true. In fact, Democrats tasked then-Rep. Sean Patrick Maloney (D–N.Y.) with compiling an autopsy of the 2016 election, only to then effectively bury it: Maloney presented the report to lawmakers ""during a members-only gathering at the Democratic Congressional Campaign Committee headquarters"" in 2017, Politico reported, but ""members were not allowed to have copies of the report and may view it only under the watchful eyes of DCCC staff.""

Clinton herself conceded defeat but apparently never quite accepted it. In the months after the election, she blamed her loss on sexism, Russian hacks, then-FBI Director James Comey's late-October announcement that the bureau had reopened its investigation into her use of a private email server…but never herself or her campaign.

True, none of those explanations is without merit. But Russian hackers did not keep Clinton from ever visiting Wisconsin during the general campaign, and Comey's letter did not enable Trump to turn out ""a flood of rural and small-town working class voters"" in Pennsylvania, as William A. Galston of the Brookings Institute wrote.

Even the 2020 election, when Joe Biden beat Trump by more than 7 million votes, provided an opportunity for reflection. ""Democrats…are entitled to a temporary feeling of triumphalism,"" Ross K. Baker wrote in January 2021, ""but there is also cause for them do some reflection on how they should reach out to the tens of millions of voters who rejected them and who are sullen and even rebellious.""

Instead, Democrats reacted as if Trump was a comic book supervillain they had banished back to his home planet, never to return.

""Relax, A Trump Comeback In 2024 Is Not Going To Happen,"" read the headline of a December 2020 piece by Politico's John Harris. ""The Trump years were not just a hallucination,"" Harris wrote. ""But chances are they will soon enough come to feel like they were — which won't leave much opportunity to return to real power.""

""Donald Trump will never be allowed to step foot in the Capitol again,"" Lawrence O'Donnell proclaimed on his MSNBC show, days after the incursion on January 6. ""Never. Unless he insists on testifying in his own defense in his Senate second impeachment trial.""

Indeed, the Capitol riot likely should have marked the end of Trump's political career: Even setting aside his potential culpability, his behavior during the violence sufficiently demonstrated his unfitness for any future returns to the White House.

But given that both Democrats and Republicans failed to convict in his Senate impeachment trial, the only way to keep him from office was to defeat him at the ballot box. Instead, Democrats apparently took Trump's unfitness as so manifestly self-evident that it was not worth interrogating why 74 million people voted for him in 2020, and whether they would do so again.

To be clear, an autopsy by itself can't turn a party's prospects around. One of the GOP report's top-line recommendations was that the party should be more amenable to immigrants, specifically from Latin America: ""If Hispanics think we do not want them here, they will close their ears to our policies."" Some Republicans were open to it: Just two days after the 2012 election, Fox News host Sean Hannity told his radio audience he had ""evolved on"" immigration, advocating ""a pathway"" to citizenship ""for those people that are here.""

The punchline, of course, is that in the very next election, the party nominated Trump, who began his campaign by calling Mexicans ""rapists"" and pledging to build a wall on the southern border.

But ironically, Trump's electoral successes have included increasing his share of Hispanic voters: Trump won nearly 30 percent of the Hispanic vote in 2016, which rose to 32 percent in 2020 and an estimated 46 percent in 2024.

A Democratic autopsy of the 2024 election would therefore ask why nearly half of all Hispanic voters would choose Trump over Harris—along with increasing numbers of nearly every other demographic group.

Even at this early juncture, possible explanations abound. Inflation, resulting from COVID-19 pandemic policy and exacerbated by Biden-era spending bills, topped many voters' lists of concerns, and voters who listed the economy as their primary concern picked Trump by a 4-to-1 margin. Joe Biden's insistence on staying in the race amid plummeting poll numbers likely also hindered Harris' ability to course-correct from an unpopular incumbent.

But to reach any sort of conclusion, Democrats will have to ignore their natural instincts to cast blame elsewhere, on disinformation or foreign interference or minor gaffes on the campaign trail. Whether they like it or not, Democrats received a drubbing on Tuesday, and only sincere soul-searching will yield any useful explanations.",center
1,https://reason.com/2024/11/05/the-inflation-election,The Inflation Election,"In retrospect, the most important incident along the road to this Election Day may not have been the Democratic Party's decision to shove aside President Joe Biden, or the unprecedented (and undemocratic) elevation of Vice President Kamala Harris to the top of the ticket. It wasn't the Republican Party's inability to break out of the thrall that Donald Trump holds over it, or the two assassination attempts aimed at him.

The thing that most shaped this election happened long before all that. It was a decision made in the early days of the Biden administration. With the last election barely in the rearview window, Biden pushed a major stimulus bill through Congress—a bill that spent $1.9 trillion, nearly all of it borrowed—despite warning signs that the already recovering economy might not be able to handle the full-throttle infusion of more dollars.

""Now is the time for big, bold action to change the course of the pandemic and begin economic recovery,"" Biden promised. Bloomberg termed it a ""big bet on run-it-hot economics,"" and noted that the White House had ""shrugged off warnings that the economy may overheat as a result.""

It was a wager that didn't pay off the way the White House had hoped.

A year later, inflation had surged to over 9 percent, its highest level in 40 years. As I've written before, that fact undersells the historical context: Before 2021, the last full year in which America experienced an average inflation rate of more than 4 percent was 1991. There was only a single year (2008) from then through 2020 when the annual inflation rate exceeded 3 percent. In other words, peak inflation in the first half of 2022 was two to three times worse than the worst bout of inflation that most Americans could easily recall.

For those of us who follow political and economic news for a living—or even as a serious hobby—all of this probably feels like, well, old news. Prices have been rising at a much more normal pace for the past year or more. In September, the annualized inflation rate was 2.4 percent. Higher than the prepandemic norm, but nothing that should cause an electoral freak-out.

But the average voter isn't a political or economics junkie, and much of America sees 2024 as the inflation election: a referendum on the federal policies that caused that brief and horrific surge in prices. (That causation is well established by now: A study by the St. Louis Federal Reserve found that ""domestic stimulus"" played a ""sizable role"" in driving inflation to 40-year highs.)

An Ipsos poll in August found that 50 percent of voters said inflation was their top concern heading into the election. In October, Gallup found that 90 percent of voters rated ""the economy"" as being ""extremely important"" or ""very important"" to their vote—the highest it has scored since the 2008 election in the depths of the mortgage crisis. Polling guru Nate Silver crunched the numbers further and found a stunning correlation: ""Each additional $100 of inflation in a state since January 2021 predicts a further 1.6 swing against Harris in our polling average vs. the Biden-Trump margin in 2020,"" he posted on X last week.

It's been impossible for the Biden-and-then-Harris ticket to escape the inflation issue for two reasons. First, Harris has been unwilling or unable to distance herself from the Biden administration. And, second, because the Biden White House made economic policy so central to its message for three years—even coming up with the counterproductive ""Bidenomics"" slogan.

""Bidenomics was, at heart, a philosophy of throwing money at programs, people, political allies, and favored constituencies. That spending contributed directly and significantly to the rapid rise in inflation that helped fuel voter dissatisfaction with the state of affairs,"" Reason's Peter Suderman summarized in a March 2024 cover story. ""Thanks to misallocation, poor implementation, and self-contradictory regulatory requirements, the substantive public payoffs to that spending have been weak at best and counterproductive at worst.""

Of course, there are logical counterpoints to the feelings voters have about inflation ahead of Election Day. For example, wages have gone up faster than prices. Moody's estimates that the average American household is now spending $1,120 more per month to buy the same goods and services as in January 2021, but is also earning $1,192 more per month. Some products have even defied inflation: Plane tickets are cheaper now than they were before the pandemic, as liberal commentator Matt Yglesias pointed out this week.

It's also true that former President Donald Trump's economic agenda seems likely to cause prices to rise. Mass deportations and huge new tariffs will cause all sorts of economic disruptions and will make Americans poorer. It seems bizarre that voters seeking a stable economy after the past four years would put their trust in an erratic populist, but if this election season has proven anything, it's that humans get pretty irrational about inflation. In part, that's because our brains attribute economic gains to our own accomplishments but look for someone (or something) else to blame when things go the other way. In other words, your paycheck got fatter because you worked harder, but your groceries got more expensive because Biden (or the big corporations) are out to get you.

Of course, that's not true—both things happened for the same reason—but inflation breaks our brains and Election Day is not a time for deep thinking about political science or psychology. Elections are decided by how people feel, and lots of Americans still feel pretty grumpy about how much it costs to go to the grocery store these days. It's really that simple.",center
2,https://reason.com/2024/11/04/dont-blame-me-for-not-voting-for-your-unbelievably-rotten-candidate,Don't Blame Me for Not Voting for Your Unbelievably Rotten Candidate,"With a day left before the 2024 polls close, I'd like to say something to the Republicans and the Democrats, the Trump chads and the Harris stans: Don't blame me for not voting for your shitty candidate.

There's a reason why presidential contests have been as tight as they have been for a while, and why control of Congress has flipped back and forth so much over the last couple of decades. It's not because of voters like me, who just want to vote for politicians and policies that won't bankrupt the country or rob me of the ability to make meaningful decisions in my life. It's not too much to ask for candidates who aren't colossal assholes, mental incompetents, or fakers that routinely lie and dissemble about all sorts of stuff. Your parties don't stand for anything consistent or appealing or responsible or responsive. You're not going to win elections easily until you stand for something consistent, productive, and respectful of the people you seek to govern.

Former President Donald Trump and Vice President Kamala Harris are arguing about which one of them will add $4 trillion in new debt vs. which one will add $8 trillion, according to mid-range estimates from the Committee for a Responsible Federal Budget. Both want to abolish taxes on tips and have their own special twists on adjacent topics. Trump has said he also wants to end taxes on overtime and Social Security income and cap credit-card interest rates, while Harris wants to shovel ""free"" money at first-time homebuyers and push for free or nearly free college, plus a bunch of other stuff. Both have pledged to maintain old-age entitlements exactly as they are, meaning federal spending has nowhere to go but up as baby boomers retire en masse and are joined by Gen Xers, the oldest of whom are pushing 60. They each threaten free speech in their own ways and traffic in delusion (Trump, for instance, can't admit he lost the popular vote in 2016 and 2020, while Kamala won't say when she knew that President Joe Biden's brain was cooked).

We know what a Trump presidency will look like because he's served already. It wasn't great, considering that most of the new debt he added to the nation's came before COVID-19 tanked the economy. But it wasn't a disaster either, at least until COVID-19 came along and he pushed to shut the country down and put together the very team of awful public health bureaucrats he spends a lot of time railing against now, as if they just showed in the Oval Office one day.

As part of the Biden administration, Harris was co-pilot during an equally mediocre run in the White House, especially when it came to prolonging or intensifying many of the worst COVID-19 policies that started under Trump. But if we're being honest, despite all the best attempts of Biden/Harris to utterly tank the economy, it seems to be doing just fine, just like it was doing under Trump (which is to say, OK but not anywhere close to where it should be). The Dow Jones is doing swell, and for all their bitching and moaning, younger Americans are doing better than previous generations, with Millennials and older Gen Zers accruing more wealth than Gen X. And miracles of miracles: Gen Z is outpacing Millennials when it comes to home ownership. The genius of America is that we survive almost any fool presiding over us.

Whatever else you can say about Trump and Harris, this much is indisputable: They are not popular. Each is pulling under 50 percent of voters the day before the election. And their parties aren't exactly reeling them in, either. Per Gallup's survey during the last two weeks of October, just 29 percent of Americans identify as Republican and just 32 percent as Democrats—figures that are near all-time lows. Let the partisans explain why the rest of us are so misguided in our indifference or hostility to these candidates and their parties. Maybe one of these years, those partisans will get around to figuring out how to appeal to people outside of the shrinking groups who already agree with them.

Last week, I voted early and wrote in the Libertarian Party presidential candidate Chase Oliver on my New York ballot. Like a lot of places, the Empire State does everything it can to bump non-major-party choices from its ballots, resulting in much lower-than-average voter participation rates over the past seven presidential elections. But screw that, I was happy to have somebody to vote for who comes close to my vision of government. He's talking about reducing the size, scope, and spending of government only a few years before our biggest budget items are about to go tits up. Good on him.

I get why Democrats and Republicans try to limit choices for voters and then denounce those of us who refuse to go along. I'm not above partisanship and in fact, I would love to be able to vote for a candidate who might actually win the presidency. But the major party candidates by and large suck and, even in an era of overheated, mentally diminished rhetoric where supporters of Kamala Harris and Donald Trump both claim this could be the last election EVER, the difference between the two is less than meets the eye. Or same thing, it's not worth picking one over the other.

That's on them, not me or my fellow citizens who are holding out for something better.",center
