article_id,url,title,content,bias
23,https://abcnews.go.com/Politics/what-is-electoral-college/story?id=115072002,What you need to know about the Electoral College as 2024 race nears end,"Harris and Trump are in a dead heat in the race to 270 electoral votes.

What you need to know about the Electoral College as 2024 race nears end

Vice President Kamala Harris and former President Donald Trump are competing for 270 Electoral College votes to win the presidency.

Vice President Kamala Harris and former President Donald Trump are competing for 270 Electoral College votes to win the presidency.

Vice President Kamala Harris and former President Donald Trump are competing for 270 Electoral College votes to win the presidency.

Vice President Kamala Harris and former President Donald Trump are competing for 270 Electoral College votes to win the presidency.

The 2024 presidential election will come to an end in a matter of days.

Vice President Kamala Harris and former President Donald Trump remain locked in a dead heat in national and battleground state polls, with all eyes on who will clinch the Electoral College.

Here is what to know about the process before Nov. 5.

What is the Electoral College?

As laid out in Article II of the Constitution, the president of the United States is elected by the Electoral College -- not the popular vote.

Under the system, each state is allocated a number of electoral votes determined by the size of its congressional delegation. The states with the largest number of electoral votes include California (54) and Texas (40).

Experts said the founders debated who should be trusted to choose the nation's leader, with some urging Congress or state legislatures to decide and others advocating for a more democratic vote.

""When they designed our system, they came up with the Electoral College not because they thought it was perfect but as a way to get the Constitution passed, and it satisfied the concerns of both the very populous states and lower populous states,"" Rachael Cobb, a political science professor at Suffolk University, told ABC News.

The White House in Washington, DC. Valerie Plesch/picture alliance via Getty Images

Though it's not a direct election of the president, they noted.

""It's really 51 separate elections,"" Barry Burden, the director of the Elections Research Center at the University of Wisconsin-Madison, told ABC News. ""Every state and the District of Columbia has its own rules for running the election. Then each state awards its electors separately, and it's up to candidates to win a majority of those electors to be elected president.""

How do electors work?

To win the presidential election, a candidate needs to capture 270 of the 538 total electoral votes.

Many states have a winner-takes-all approach, meaning that whichever candidate wins the most votes statewide receives all its electoral votes. Two states, however, split their electoral votes: Nebraska allocates three of its five electoral votes by district and Maine allocates two of its four votes by district.

Electors are usually selected by the state's political parties.

While the Constitution doesn't bind electors to vote for the winner of the popular vote in their state, many legislatures have laws in place to prevent an elector from rogue -- or what's called a ""faithless elector.""

In 2020, some Republican allies of Trump tried to submit fake slates of electors to Congress to undermine President Joe Biden's victory. Several people were prosecuted for their role in the scheme.

Why is it so crucial to this election?

Polls ahead of Election Day show a razor-thin race between Harris and Trump.

It will likely all come down to just a handful of swing states: Arizona, Georgia, Michigan, Nevada, North Carolina, Pennsylvania and Wisconsin.

Some of those states were decided by just 10,000 to 20,000 votes in 2020, and the margins are expected to be just as close in 2024.

2024 Electoral College Map ABC News

Pennsylvania is considered crucial to the outcome of the race, as it boasts the most electoral votes (19) of any of the battlegrounds. The state cemented President Joe Biden’s victory in 2020, flipping blue after going red for Trump in 2016.

If Harris wins Pennsylvania along with Michigan, Wisconsin and a single electoral vote in Nebraska (all of which Biden won in 2020) she would reach 270 electoral votes even if she were to lose the remaining four swing states.

If Trump wins Pennsylvania, and holds all the states he won in 2020, he would need to also flip Georgia to win.

What if there is an Electoral College tie?

A 269-269 tie is not outside the realm of possibility, though it's unlikely.

It's happened only once under the current rules of the Electoral College: the 1824 presidential election.

In that case, as the Constitution requires, Congress carried out a ""contingent election"" to decide the winner. A contingent election requires the House of Representatives to select the winner, with each state having one vote. A candidate would need support from 26 of the 50 states to be elected.

Vice President Mike Pence and House Speaker Nancy Pelosi preside over a Joint session of Congress to certify the 2020 Electoral College results after supporters of President Donald Trump stormed the Capitol earlier in the day on Capitol Hill in Washington, DC on January 6, 2021. J. Scott Applewhite/POOL/AFP via Getty Images

538 has analyzed the different scenarios in which a tie could result between Vice President Harris and former President Trump.

Cobb called the possibility of a tie a ""real concern"" this year and explained what would likely happen next.

""The House of Representatives is controlled by Republicans and so the likely outcome in this election, should it be a tie and should it go to the House of Representatives, is that the Republican nominee would win,"" Cobb said.

What about the popular vote?

""It's a symbolic victory to win the popular vote, but it's not required,"" Burden said. ""And twice in the last five elections, we've seen the popular vote go one direction and the Electoral College go the other. That could well happen this time as well.""

Candidates who lost the popular vote but won the Electoral College are John Quincy Adams in 1824, Rutherford B. Hayes in 1876, Benjamin Harrison in 1888, George W. Bush in 2000 and Trump in 2016.

After the 2016 election, when Hillary Clinton eclipsed Trump in the popular vote by nearly 3 million but lost the Electoral College, debate sparked about whether the system should change.

People participate in the Women's March in Los Angeles, Jan. 21, 2017. Joe Sohm/Visions of America/Universal Images Group via Getty Images

Pros and cons of the Electoral College, according to experts

Those in favor of the Electoral College generally note its written into the nation's founding document and has largely worked since then.

""Many aspects of the Constitution have not been changed since 1789 and are still in place. The Electoral College is still mostly operating the way it was originally intended. So why mess with success?"" Burden said.

Burden and Cobb noted it also forces campaigns to focus on traveling from state to state to meet voters. Without the need to win electors, presidential contenders would instead likely run a more nationalized campaign and focus on highly-populated cities while ignoring smaller, rural communities.

The main reasoning against the Electoral College is that it means not every vote is equal, as a handful of key swing states usually determine the winner of an election.

""Another argument is that, essentially, it has disproportionate influence,"" Cobb said. ""That smaller states have a disproportionately higher number of electoral votes relative to their population, meaning that individual votes in these states carry more weight than in those larger states.""

""The one person, one vote idea has really taken hold in the United States over time, and the Electoral College does not meet that,"" said Burden. ""Votes are unequal. Some voters matter a lot more, and others matter less. And that's inconsistent with really every other kind of election in the United States.""",left
24,https://abcnews.go.com/Politics/undecided-voters-wrestling-decision-election-day-approaches/story?id=115273162,Some voters still say they're undecided in the 2024 election. Here's why.,"Some voters still say they're undecided in the 2024 election. Here's why.

Less than a week out to Election Day, both former President Donald Trump and Vice President Kamala Harris are barnstorming battleground states, trying to reach and persuade undecided voters -- including independents -- to support them.

Independents are often swing voters, who may switch their allegiance from election to election. Statistically, they are a big enough group to make a difference in the results.

In a recent ABC News/Ipsos poll, 13% of independents said they were initially undecided. The poll also found Trump running essentially even with Harris among independents.

ABC News spoke with some of those independent voters who responded to the poll, as well as some undecided or formerly undecided voters who have been in touch with ABC News throughout the year, to get a sense of why they still feel undecided -- or what their decision was in the end.

Some brought up themes and issues that have been salient throughout the election, including the border and abortion.

Vice President and Democratic presidential candidate Kamala Harris speaks at rally in Harrisburg, Pa., Oct.30, 2024, and former President and Republican presidential candidate Donald Trump speaks at a rally in Allentown, Pa., Oct. 29, 2024. Angela Weiss/AFP via Getty Images

Phyllis Allen, an independent voter who lives near Mobile, Alabama, and responded to the ABC News/Ipsos poll, told ABC News on Thursday that she is still unsure who she will vote for or if she will cast a vote for president at all.

She is leaning towards Trump, she said, because ""when he was in office, the last time, things were better for me and my family -- we've been struggling. it's hard, but since Biden has been in office, it seems like we've been struggling just to pay bills and just to buy groceries."" She said she also appreciated how she felt people were prouder to be American when he was president.

But how Trump has often spoken about Christianity has concerned her. Trump has often framed his potential presidency around being better for Christians than a Harris presidency, although he has also reached out towards other religious groups.

""There's so many religions in the United States, that's what the United States was built on … it's not fair to just push one religion,"" Allen said.

Citizens participate in early voting at a Dekalb County advance polling location in Atlanta, Georgia, Oct. 30, 2024. Erik S Lesser/EPA-EFE/Shutterstock

Allen added that she disagrees with Harris on border issues, feeling that if she is struggling to afford groceries or qualify for food stamps, it is unfair for undocumented immigrants to have any government support.

More broadly, she said she feels Harris could have already accomplished her policy proposals: ""Kamala Harris has been in there, and she's saying she's gonna do all this stuff, but yet she was already in office. Why didn't she go ahead... Why not now? Why wait until she gets to be president?""

But Allen aligns more with Harris on abortion issues. ""Roe versus Wade -- they need to reinstate [it],"" she said, referring to the U.S. Supreme Court overruling the decision granting a constitutional right to abortion in the United States.

""I mean, I don't personally believe in abortion, but it's not my decision to tell someone else what they could do,"" Allen said, later bringing up (albeit not by name) the story of Kate Cox, a woman who had to leave her home state of Texas to get an abortion to protect her health.

""A lot of Christian churches and stuff like that, they all say it's wrong, it's wrong, it's wrong -- but it's not their place to tell a woman what's wrong or right.""

Benjamin, an independent voter from Texas who also responded to the ABC News/Ipsos poll, said that he is leaning towards Trump but still trying to come to a final decision. (He asked that ABC News not publish his last name for privacy reasons.)

""I care a little bit more about my financial situation. And so, back when Trump was president, I remember that things were a lot cheaper for me than compared to when Biden was, but then at the same time, I don't agree with a lot of I don't agree with a lot of the way Trump thinks,"" he said, adding he agrees a bit more with how Harris thinks, although not on every issue.

Benjamin plans to try to vote early, although as a student who works part-time at a department store, he does not know if he'll be able to get to the polls before Election Day.

A voting sign is displayed near the entrance of the Millennium Youth Complex, Oct. 21, 2024, in Austin, Texas. Brandon Bell/Getty Images

He said he tries to ignore the news, and feels news outlets are often biased, so he prefers to do his own research. He does not plan to vote down the ballot in Texas, which is also home to a hotly contested U.S. Senate race.

What could sway him to Trump or Harris? For Trump, he said, he'd have to find something positive that ""really sways me toward him in that way,"" while for Harris, he is looking for her not to be ""too extreme"" on issues such as immigration and abortion. (He said he believes in restricting illegal immigration but does want the border ""to be more open and make it easier for people to come over."")

Separately from the independents who responded to the ABC News/Ipsos poll, some of the undecided voters who have been in touch with ABC News throughout the presidential election season said that they've made a decision while others still feel conflicted.

Rebecca Bakker, a registered nursing professor who lives near Grand Rapids, Michigan, had already decided against voting for Trump but has not felt compelled yet towards Harris or any third-party candidates.

She told ABC News on Wednesday, ""I'm leaning libertarian, but I don't know by casting a libertarian vote is going to hurt or help either one of them."" (Libertarian presidential candidate Chase Oliver is on the ballot in Michigan. Bakker said she is compelled by the party's platform but not by its ticket specifically. )

She is still unhappy with Harris' position on the border.

""I think she's got to demonstrate that she's willing to work with both sides and maybe choke on the wall a little bit to avoid getting another influx of illegal immigrants. But she doesn't seem willing to even bend on that issue or willing to work with the other side,"" Bakker said.

Bakker acknowledged Harris is walking ""a fine line"" on how she can differentiate herself from Biden.

""I think she's struggling with separating herself from Joe Biden and making a name for Kamala Harris… I think that's what's going to drive a lot of people away from her.""

Conversely, on the Israel-Hamas war, Bakker indicated that her views are to the left of Harris' support of continued military funding to Israel.

""I understand Israel has a right to defend itself, but I'm really concerned that they continue to supply them with money and weapons when all the Israelis are doing are killing Palestinians in the hopes of finding one bad Hamas guy... So I don't understand this impetus to continue to fund that particular war because they're not making any progress,"" Bakker said.

Bakker said she may try to vote early, but may be more available on Election Day.

""Her closing arguments haven't quite pushed me over the edge,"" Bakker said of Harris. ""I'm not going to vote for Donald Trump. It's not going to happen, but a vote for Harris… I'll probably be forced to do it. I'm going to do it under duress, and hopefully we can dig out later. But she hasn't done anything to actually convince me that that's the best option.""

Matthew Labkovski, a Republican voter from Florida who supported former United Nations Ambassador Nikki Haley during the Republican presidential primaries, was still undecided as of early October. By now, he told ABC News in a phone interview on Wednesday, he's voted -- but ""just felt that I couldn't personally come to either candidate,"" and wrote in Haley.

Asked what Harris or Trump could have done differently to reach out to voters like him, Labkovski said he wished Harris had chosen Pennsylvania Gov. Josh Shapiro as her running mate. Shapiro was among the final rumored contenders before Harris chose Walz.

People vote at the Government Center on Florida's first early voting day for the 2024 US presidential election in Miami, Florida, Oct. 21, 2024. Cristobal Herrera-ulashkevich/ep/CRISTOBAL HERRERA-ULASHKEVICH/EP

As for Trump -- who he had previously decided not to vote for -- Labkovski said he was looking for Trump to acknowledge shortcomings.

""Maybe an apology, or some sense of remorse for anything -- not anything in particular, just that he was, he's human … things happen because things happen as a president, and I don't want someone who thinks that it's not their fault.""

Labkovski did vote down the ballot for the Democratic Senate candidate, former Rep. Debbie Mucarsel-Powell, which he said was more as a ""wake-up call"" vote to incumbent Republican Sen. Rick Scott, and voted yes on Amendment 4, the proposition that would enshrine abortion access in the state's constitution. That would effectively overturn the state's 6-week abortion ban.

""I believe that it provides choice,"" he said, adding that as someone who plans to work in medicine, ""I think that there needs to be an opportunity for choice and for discussion.""

Editor's note: This story has been updated.",left
25,https://abcnews.go.com/Politics/gender-gap-decide-2024-election/story?id=115272924,Will the gender gap decide the 2024 election?,"Some observers are bracing for a ""gender chasm"" between Harris and Trump.

The gender gap is expected to play a key role in the 2024 presidential election.

The gender gap is expected to play a key role in the 2024 presidential election.

The gender gap is expected to play a key role in the 2024 presidential election.

The gender gap is expected to play a key role in the 2024 presidential election.

Men and women have been voting differently in presidential elections for decades.

But could the gender gap be the deciding factor in this year's razor-thin race between Vice President Kamala Harris and former President Donald Trump?

The final ABC News/Ipsos poll before Election Day, released on Sunday, found the gender gap among all likely voters to be 16 points. Harris had a 11-point advantage among women, 53% to 42%, while Trump had a 5-point advantage among men, 50% to 45%.

A 538 analysis of national polling crosstabs in October from its most highly-rated pollsters found the average gender gap was slightly wider: 10 points for Harris among women and 9 points for Trump among men.

That is on par with historical norms. The gender gap has averaged 19 points in presidential exit polls since 1996.

The gender gap is expected to play a key role in the 2024 presidential election. ABC News Photo Illustration by Dani Grandison, AP Photo/Susan Walsh/ Julia Demaree Nikhinson, Adobe Stock

Some observers, though, believe it could reach a new level in 2024.

""With a woman versus a man at the top of the ticket and with the prominence of the abortion issue in the wake of the Dobbs decision, we could have a historically large gender gap approaching a gender chasm this year,"" Whit Ayres, a longtime Republican pollster, told ABC News.

The formula to success for Harris would be to win women by more than she loses men. The reverse is true for Trump.

""When you're talking about dead heat races in seven swing states, anything could be the deciding factor,"" Ayres said.

Both campaigns try to turn the gap to their favor

Harris has made reproductive freedom a centerpiece of her White House bid. In recent weeks, she rallied with Beyoncé in front of tens of thousands in Texas on abortion rights, visited a doctor's office in battleground Michigan and deployed high-profile surrogates like Michelle Obama to talk about the impact on women's health after the fall of Roe v. Wade.

""I think you can't underestimate the power of the abortion issue,"" Celinda Lake, a veteran Democratic pollster, told ABC News.

That's especially true, Lake said, among younger women. Harris has an overwhelming lead (40 percentage points) among women ages 19 to 29 compared with Trump's 5-point advantage among men in that same age range, ABC News and Ipsos found.

""They are registered in record numbers but we have to make sure they all turn out to vote,"" Lake said of Gen Z women.

Democratic presidential nominee Vice President Kamala Harris delivers remarks at a church service at Greater Emmanuel Institutional Church of God in Christ in Detroit, Mich., Nov. 03, 2024. Brandon Bell/Getty Images

Harris' campaign has also done extensive outreach to men, including Black men, through her economic proposals. Polls earlier this fall showed support from Black men for Harris was eroding from President Joe Biden's numbers with the group, though Harris has appeared to regain ground. In the final ABC News/Ipsos poll, Harris had support from 76% of Black men (Biden won Black men by 79% in 2020) and 87% of Black women.

Trump, meanwhile, has focused on driving men to the polls, particularly younger and apolitical men who vote at lower rates than other groups.

Both Trump and his running mate, Ohio Sen. JD Vance, sat down with popular podcast host Joe Rogan. Trump's surrounded himself with hyper-masculine figures on the trail, including Elon Musk and Hulk Hogan. He's embodied a strongman persona and doubled down on authoritarian rhetoric.

White men and women have long been among the Republican Party's strongest constituencies. Trump is leading with white men by 13 points, according to the latest ABC News/Ipsos poll, and among non-college educated white men and women by roughly 30 points. And while he leads with white women, the largest voting bloc in the U.S., Trump is only edging out Harris by 4 points: 50% to 46%. (Trump won white women by 11 points in 2020 against Biden.)

Republican presidential nominee and former President Donald Trump holds a rally in Lititz, Pa., Nov. 3, 2024. Brian Snyder/Reuters

Trump has also ramped up efforts to court Hispanic voters, a demographic that has its own significant gender divide, more this campaign than in his previous presidential bids. The ABC News/Ipsos survey found an average of 55% support for Harris among Hispanic likely voters and 41% for Trump. (Biden won Hispanic people by 33 points in 2020, according to the ABC News exit poll.)

""I think Trump is trying to drive up his vote among men,"" said Ayres. ""I haven't seen a whole lot of outreach to women.""

The former president's recent messaging to women is that he will ""protect"" them ""whether the women like it or not"" -- a line that went against the guidance of advisers, whom he claimed had called the statement ""very inappropriate."" Harris quickly seized on the comment as ""offensive to everybody.""

Turnout will be key

More than 75 million Americans have voted early, according to the University of Florida's Election Lab.

Women are outpacing men in early vote turnout, the data shows, 54% to 43.6% as of Sunday. That is in line with past elections, including in 2020 when women made up 53% of the electorate.

Tom Bonier, a Democratic strategist and CEO of the data firm TargetSmart, said one notable takeaway is that women are voting early at higher rates than men by ""pretty substantial margins in every battleground state except Nevada.""

Voter's head into a polling location to cast their ballots on the last day of early voting for the 2024 election, Nov. 1, 2024, in Atlanta. Megan Varner/Getty Images

It is unknown which candidate early voters are casting their ballots for and unlike in 2020, when Trump discouraged mail-in voting, more Republicans are voting early this year.

But Democrats see optimism in the margins.

""There's just simply more women in the electorate and they turn out to vote more,"" said Elaine Kamarck, a senior fellow at the Brookings Institution who worked on several presidential campaigns. ""If you add in their preference for Harris over Trump, this should be very good news for Harris.""

538's Mary Radcliffe contributed to this report.",left
