article_id,url,title,content,bias
36,https://www.zerohedge.com/political/your-guide-voting-2024-election,Your Guide To Voting In The 2024 Election,"Authored by Samantha Flom via The Epoch Times (emphasis ours),

With just weeks to go until the general election, election offices across the country are making their final preparations, and in some cases, accepting ballots.

Here are the answers to some common questions voters may have as they gear up to cast their ballots.

Illustration by The Epoch Times, Getty Images

When Is Election Day?

Election Day is Tuesday, Nov. 5.

Who Can Vote?

Only U.S. citizens ages 18 or older are permitted to vote in federal elections.

Can I Vote Early?

That depends on your state.

Most states offer early or absentee voting for any reason, though a few (Alabama, Mississippi, and New Hampshire) require voters to meet certain eligibility requirements.

To vote absentee, you will need to request a ballot before your state’s deadline unless you live in one of a handful of states that automatically mail out ballots to all voters.

Those states include California, Colorado, Hawaii, Nevada, Oregon, Utah, Vermont, Washington, and the District of Columbia, which allow all elections to be conducted by mail.

You can check your eligibility and request an absentee ballot through your local election office or via Vote.org. Ballots can be returned via mail, in-person at your local election office, or via a drop box, if your state uses them.

In most states, you can track the status of your absentee ballot online. Some may also offer text or email alerts to keep you updated as your ballot is processed.

Early in-person voting is also available in most states, though dates vary. Check this calendar to see when early voting begins and ends in your state.

Voters stand in a line outside a satellite polling station in Philadelphia on Oct. 27, 2020. Mark Makela/Getty Images

What Do I Need to Do?

The first step to voting—early or otherwise—is to make sure you are registered. All states and territories, save North Dakota, require voters to register.

You can check the status of your voter registration here. Online registration is also available up until your state’s deadline.

Most states also either require or request that voters present some form of ID to vote in person, though rules vary.

In some cases, voters may be allowed to vote without any form of identification. Check your state’s requirements here.

Lastly, before heading to the polls, verify your polling location and the hours it will open with your local elections office.

What Are the Top Races?

With control of the House, Senate, and White House up for grabs, there are many races on this year’s ballot that could prove critical to the balance of power in Washington.

Democrat Vice President Kamala Harris is seeking a promotion to the role of president, while former President Donald Trump, the Republican nominee, is hoping to secure a second term.

Their running mates, Minnesota Gov. Tim Walz and Sen. JD Vance of Ohio will also be on the ballot.

(Left) Former President Donald Trump, and vice presidential candidate Sen. J.D. Vance (R-Ohio) pose for a photo before at an event in Asheboro, N.C., on Aug. 21, 2024. (Right) Vice President Kamala Harris and her running mate Minnesota Gov. Tim Walz step off Air Force Two upon arrival in Savannah, Ga., on Aug. 28, 2024. Melissa Sue Gerrits/Getty Images, Saul Loeb/AFP via Getty Images

On Capitol Hill, Republicans’ control of the House and the Democrat majority in the Senate are both hanging by a thread.

With all 435 House seats up for election, Democrats need only flip four to take control of the chamber.

New York’s 4th Congressional District is one place they are eyeing for a gain.

There, freshman Rep. Anthony D’Esposito, a Republican, is defending his seat against Democrat Laura Gillen, former Hempstead town supervisor, in a rematch of 2022.

The race for Arizona’s 1st District seat, currently held by Republican Rep. David Schweikert, is another where Democrats could pull off an upset.

Schweikert won the district by about 3,200 votes in 2022—a thin margin that could bode well for his Democrat challenger, former state Rep. Amish Shah.

Republicans, on the other hand, are hoping to expand their majority by flipping Maine’s 2nd Congressional District, where former NASCAR driver and Republican state lawmaker Austin Theriault is taking on three-term Democrat Rep. Jared Golden.

Pennsylvania’s 8th District is also on Republicans’ radar.

(Left) Austin Theriault greets fans during driver introductions for the NASCAR Monster Energy Cup series auto race at Richmond Raceway in Richmond, Va., on Sept. 21, 2019. (Right) Rep. Jared Golden (D-Maine) speaks in Bath, Maine, on April 27, 2019. Steve Helber/AP Photo, David Sharp/AP Photo

Trump carried the district twice, and with the 45th president on the ballot again, Democrat Rep. Matt Cartwright could lose his seat to Republican businessman Rob Bresnahan.

In the Senate, Republicans are targeting the seats of several vulnerable Democrats and independents in hopes of retaking the upper chamber.

One they are expected to win handily is the seat of West Virginia’s newly independent Sen. Joe Manchin, who is not seeking reelection.

Before Manchin’s affiliation change in May, he was West Virginia’s sole remaining Democrat in a statewide office.

Although he endorsed Wheeling’s Democrat Mayor Glenn Elliott to take his place, West Virginians are widely expected to pick Republican Jim Justice, the current governor, to fill the seat.

In Montana, another GOP stronghold, Democrat Sen. Jon Tester is in danger of losing his race against Republican Tim Sheehy, a former Navy SEAL and entrepreneur.

The latest RealClearPolitics average of polls shows Tester trailing his challenger by more than 5 points.

(Left) Sen. Jon Tester (D-Mt.) arrives for a Senate Banking, Housing, and Urban Affairs Committee hearing at the Dirksen Senate Office Building in Washington on Feb. 8, 2024. (Right) Montana Republican U.S. Senate candidate Tim Sheehy speaks at the Republican National Convention in Milwaukee on July 16, 2024. Kevin Dietsch/Getty Images, Chip Somodevilla/Getty Images

Ohio’s Democrat Sen. Sherrod Brown is in a similar position. He’s defending his seat against Trump-endorsed entrepreneur Bernie Moreno in another state that tends to lean Republican.

However, in that case, the RealClearPolitics average of polls favors Brown by 3.6 points.

Meanwhile, Sens. Ted Cruz (R-Texas) and Rick Scott (R-Fla.) are looking to stave off Democrat challengers in two reliably red states.

And the race to replace Arizona’s independent Sen. Kyrsten Sinema is also sure to be closely watched, with Trump ally and former gubernatorial candidate Kari Lake set to take on Democrat Rep. Ruben Gallego.

Other Senate battlegrounds include Michigan, Nevada, Pennsylvania, Maryland, and Wisconsin.

(Top Left) Sen. Sherrod Brown (D-Ohio) speaks at a press conference outside the U.S. Capitol on April 18, 2023. (Top Right) Republican U.S. Senate candidate Bernie Moreno speaks at the Republican Party of Cuyahoga County in Independence, Ohio, on March 19, 2024. (Bottom Left) Sen. Kyrsten Sinema (I-Ariz.) speaks during the Senate Finance Committee hearing on Capitol Hill on Oct. 19, 2021. (Bottom Right) Republican U.S. Senate candidate Kari Lake arrives at a caucus night party in Des Moines, Iowa, on Jan. 15, 2024. Anna Moneymaker/Getty Images, Madalina Vasiliu/The Epoch Times, Mandel Ngan/Pool/Getty Images, Alex Wong/Getty Images

When Will We Know Results?

With the recent rise in the popularity of mail-in voting, it’s unlikely every race will be decided on election night.

Each state has different laws governing how long absentee ballots may be accepted and when election offices may start counting them.

Some states allow that process to begin before Election Day, whereas others require officials to wait until after the polls close.

Because of those rules, counting continued days past Election Day in many states in 2020, prompting questions about the accuracy and validity of the results.

The U.S. Postal Service encourages those voting by mail to mail their completed ballots before Election Day and at least one week before their state’s deadline to ensure their vote is counted.

The Associated Press contributed to this report.",right
37,https://www.zerohedge.com/political/trump-election-odds-near-67-polymarket-whale-bets-another-2m,Trump Election Odds Near 67% As Polymarket Whale Bets Another $2M,"Authored by Zoltan Vardai via CoinTelegraph.com,

Former United States President Donald Trump’s lead on the top blockchain-based betting market is nearing 67% as a mysterious whale continues to bet on his victory in the upcoming presidential election on Nov. 5.

Trump’s odds of winning the election surpassed 66.3% on the leading decentralized predictions market on Oct. 28, according to Polymarket data.

Presidential election winner 2024, one-month chart. Source: Polymarket

Trump’s odds increased after a Polymarket whale, or large holder, invested another $2 million worth of USD Coin USDC$1.00 tokens into pro-Trump bets.

The mysterious whale has spent $7.22 million on “Yes” shares, according to onchain intelligence firm Lookonchain, which wrote in an Oct. 28 X post:

“Since Oct 11, the whale has spent 7.22 million $USDC to buy 11.28 million ‘Yes' shares on Donald Trump winning the US election, with an unrealized profit of $256,000.”

With only seven days until the 2024 US presidential election, decentralized prediction markets may offer more accurate predictions than traditional polling systems, according to billionaire Elon Musk.

The Polymarket odds flipped in Trump’s favor on Oct. 4, marking a sharp reversal from September. By Oct. 12, Trump was leading by over 10 points, Cointelegraph reported.

Mysterious Polymarket whale seems unrelated to “Fredi9999”

The mysterious Polymarket whale, known as “zxgngl,” holds over 11.2 million “Yes” votes worth over $7.5 million, according to Polymarket data.

Zxgngl, Polymarket whale, positions. Source: Polymarket

The increasing positions come after the top Trump bettor on Polymarket, “Fredi9999,” bolstered Trump’s odds above 60.2% by buying over $20 million worth of “Yes” shares up to Oct. 18.

Moreover, Fredi’s transaction patterns suggest that it controls four of the six largest Trump-voting accounts on Polymarket, all funded with Kraken deposits.

Leading Trump bettors. Source: PolyMarket

While 99% of zxgngl’s bets were also placed on Trump, their account was funded by Binance, not the Kraken exchange. Their transaction patterns are also different, with the last two Binance deposits being worth $338,000 and $1.68 million, respectively.

Zxgngl, Polymarket deposits. Source: Lookonchain

As for Fredi, the account is likely controlled by a person with deep confidence in a Trump victory, according to pseudonymous political bettor Domer, who told Cointelegraph:

“My guess is it is a true believer who is very rich and trying to make a big bet. He is getting more confident as the price goes higher and is in a confirmation bias loop where new information keeps increasing his confidence.”

US presidential elections fuel 565% prediction market growth

The upcoming US elections have boosted investor interest in prediction markets.

The betting volume on prediction markets rose over 565.4% in the third quarter to reach $3.1 billion across the three largest markets, up from just $463.3 million in the second quarter.

Top three crypto prediction markets. Source: CoinGecko

This significant third-quarter growth is mainly attributed to the US elections, according to an Oct. 14 CoinGecko report.

Polymarket, the most prominent decentralized betting platform, dominated the market with over a 99% market share as of September.",right
38,https://www.zerohedge.com/political/look-legal-issues-surrounding-2024-election,A Look At The Legal Issues Surrounding The 2024 Election,"Authored by Sam Dorman via The Epoch Times (emphasis ours),

The run-up to the 2024 election has seen a number of consequential court cases and rulings related to how voters cast their ballots and how governments process the election results.

Some of the cases remain ongoing, and if 2024 is anything like 2020, the nation could see a flurry of lawsuits after Election Day with candidates also challenging the outcomes.

Illustration by The Epoch Times, Getty Images, Shutterstock

It is, however, unclear how far any legal case will go, with experts doubting that a Supreme Court case will result from the ongoing slate of legal challenges.

“Judges throughout the country ... are loath to be perceived as disenfranchising individuals,” Landmark Legal Vice President of Legal Affairs Mike O’Neill told The Epoch Times.

“If they have an exit ramp to either dismiss a case or a procedural exit ramp to dismiss a case, they’re going to take [it]—even despite the fact that there might be evidence of either some sort of failure to follow proper procedures or failure to follow necessary registration procedures.”

Here are some legal issues to watch heading into November.

Mail-In or Absentee Ballots

Perhaps the most contentious election issue in 2020 was the widespread use of mail-in ballots, brought on by the government response to the COVID-19 pandemic.

A survey from the U.S. Election Assistance Commission, a federal body established by Congress, showed that the number of mail-in ballots increased by 20 percent between 2016 and 2020.

“Because we’re no longer in the COVID situation, we’re not going to see the same level of court-driven outcomes in our elections,” Public Interest Legal Foundation President J. Christian Adams told The Epoch Times. “I think that’s the big difference between now and 2020.”

A recent lawsuit in Pennsylvania, one of the more hotly contested states in 2020, dealt with how to process mail-in ballots that lack proper dates and other information. A practice known as ballot curing allows voters to correct deficiencies in their ballots after submitting them.

“Ballots come in, they take quite a bit more processing, making sure that it’s the person who voted to send him in all those things, and so it’s just a slower process,” Honest Elections Project Vice President Chad Ennis told The Epoch Times.

Earlier this month, the state supreme court declined to hear Republicans’ challenge to the state notifying voters of deficiencies in their ballots.

In Nevada and Mississippi, similar challenges surround ballots received after Election Day.

Voters make their selections at voting booths inside an early voting site in Hendersonville, N.C., on Oct. 17, 2024. Melissa Sue Gerrits/Getty Images

The issue reached the U.S. Court of Appeals for the Fifth Circuit, which heard arguments in September over the Republican National Committee’s (RNC’s) claim that Mississippi should not count those ballots—even if properly postmarked.

Texas passed an omnibus election security package in 2021 with provisions that were halted by a district court judge this month.

More specifically, Judge Xavier Rodriguez blocked Texas from preventing compensation for assisting voters with their mail-in ballots.

He also enjoined a restriction on compensation for vote harvesting services, which the law defined as “in-person interaction with one or more voters, in the physical presence of an official ballot or a ballot voted by mail, intended to deliver votes for a specific candidate or measure.”

Both provisions violated the Voting Rights Act, according to Rodriguez.

In Michigan, North Carolina, and Pennsylvania, Republicans have also filed lawsuits challenging ballots submitted from individuals who are overseas.

A law known as the Uniformed and Overseas Citizens Absentee Voting Act requires states to allow ballots from Americans who live overseas, but Republicans have argued that state officials in North Carolina and Pennsylvania are illegally exempting overseas Americans from verification requirements.

They similarly argued that Michigan officials have registered people who don’t reside in the state.

Certification

Fulton County Superior Court Judge Robert McBurney heard arguments on Oct. 1 over Democrats’ challenge to Georgia state election board policies surrounding certification.

One of the rules requires officials to make a “reasonable inquiry” before certifying the results while another allows officials to review documentation “created during the conduct of elections.”

Georgia's State Election Board members discuss proposals on election rule changes at the state capitol in Atlanta on Sept. 20, 2024. Mike Stewart/AP Photo

McBurney seemed inclined to uphold the rules but with clarification of the reasonable inquiry rule, which he said was “vague.”

On Oct. 15, he issued a ruling stating that election superintendents couldn’t refuse to certify election results or abstain from doing so, even under Georgia’s new rule.

He added that delays in election officials receiving information related to the election was “not a basis for refusing to certify the election results or abstaining from doing so.”

Another ruling by McBurney, on Oct. 15, held that the Georgia election board had acted too closely to an election when it tried to impose a rule requiring ballots be counted by hand.

The following day, Superior Court Judge Thomas Cox issued a ruling invalidating that rule and six others from the state election board—including the one requiring election officials to conduct a “reasonable inquiry.” The RNC quickly appealed the decision.

Fulton County Superior Judge Robert McBurney in Atlanta on May 2, 2022. Ben Gray/AP Photo

Voter Rolls

The Department of Justice has sued both Alabama and Virginia over their attempts to clean up their state’s voter rolls prior to the election.

On Oct. 16, a federal judge in Alabama halted the state’s program with a preliminary injunction.

Both lawsuits cite something known as the “Quiet Period Provision” of the National Voter Registration Act, which says: “A state shall complete, not later than 90 days prior to the date of a primary or general election for Federal office, any program the purpose of which is to systematically remove the names of ineligible voters from the official lists of eligible voters.”

Multiple disputes over election rolls have emerged in Arizona, where election officials found that nearly 100,000 voters were able to vote despite not providing proof of citizenship.

The U.S. Supreme Court intervened in August by halting the effects of a lower court decision that blocked Arizona’s law requiring officials to reject state voter registration forms that lacked proof of citizenship.

More recently, a federal judge ruled against an Arizona group’s legal effort to force county officials to investigate ahead of the upcoming general election whether more than 40,000 registered voters are U.S. citizens.

The RNC has raised other allegations about noncitizen voting in Maine as well as Nevada, where the RNC and the Trump campaign sued the secretary of state.

Hearings in the Fifth Circuit and Georgia have also raised questions about the Purcell principle, which comes from the U.S. Supreme Court’s 2006 decision in Purcell v. Gonzalez.

It generally cautions against election policy changes just before voters head to the polls.

The court’s opinion didn’t set out a specific timetable for allowable changes to election procedures. Instead, it reversed an appeals court decision striking down Arizona’s voter ID law.

Read the rest here...",right
39,https://www.zerohedge.com/political/arizona-officials-it-will-take-nearly-2-weeks-tabulate-2024-election-maricopa,Arizona Officials: It Will Take Nearly 2 Weeks To Tabulate 2024 Election In Maricopa,"Authored by Jack Phillips via The Epoch Times (emphasis ours),

Officials in Arizona’s most populous county warned on Oct. 22 that it may take between 10 and 13 days to tabulate the results of the Nov. 5 election.

County officials are asking “for the community’s patience,” Maricopa County Deputy Elections Director Jennifer Liewer said in a press conference on Oct. 22.

An election worker scans mail in ballots at the Maricopa County Tabulation and Election Center in Phoenix on Nov. 7, 2022. Justin Sullivan/Getty Images

“This year, we do expect that it will take between 10 and 13 days to complete tabulation of all of the ballots that come in,” she said.

“We want to make sure that this is a secure process, but we also want to make sure that it is an accurate process.”

Assistant Maricopa County Manager Zach Schira said at the press conference, “If I have one message for voters here today, it is this: that the longer ballots and higher interest in this 2024 general election will create longer lines on Election Day, and that’s okay.”

Schira said that if people want to avoid the long lines, they are advised to vote by mail or early in person.

Maricopa County Supervisor Bill Gates said the tabulation may take so long because the ballot is two pages, there are dozens of contests per ballot, and there is heightened interest in the presidential election. He said more than 2.1 million Maricopa voters are expected to cast their ballot for the Nov. 5 contest, noting that 400,000 people so far have voted.

The “top message for voters” on Oct. 22 is “if you want to save time and avoid lines, vote early,” the county wrote on social media platform X. Voters have until Oct. 25 to request an early ballot, it noted.

Early voting data compiled by the University of Florida show that Republicans have a 38,000-vote advantage in terms of early voting in Arizona. Only mail-in ballots have been returned so far, but the data show that 41.9 percent of early ballots have been submitted by Republicans, compared with 36.3 by Democrats. Independent or third-party voters make up about 21.8 percent of the total.

Arizona, considered a battleground state, is again expected to be a close race during the 2024 election. State election officials in 2020 certified the race in Arizona for Joe Biden over President Donald Trump by a margin of about 11,000 votes.

In the aftermath of the 2020 contest, Trump and other Republicans alleged that Arizona’s election was marred by voter fraud, sparking a number of lawsuits against Arizona and Maricopa County officials that were all ultimately dismissed.

For that election, county officials certified the results 17 days after Election Day, according to a statement issued on Nov. 20, 2020. A significant number of voters cast ballots early in person or by mail in the midst of the COVID-19 pandemic and associated stay-at-home and lockdown orders and rules.

Maricopa County, which encompasses the city of Phoenix, is by far the most populous area in Arizona. As of March, it had more than 4.5 million residents, which is more than half the state’s entire population.

Trump is expected to campaign in Arizona on Oct. 24, holding a rally at Arizona State University’s arena in Tempe. Harris visited Arizona near the U.S.–Mexico border in late September.

Before his trip to Arizona, Trump is scheduled to headline a rally in Duluth, Georgia, on Oct. 23 with guests Tucker Carlson and Robert F. Kennedy Jr.

Vice President Kamala Harris is also focusing on battleground states and will be traveling to the outskirts of Philadelphia to participate in a live CNN town hall event with undecided voters from Pennsylvania. An interview she recorded with Telemundo, a Spanish language network, on Oct. 22 is also due to air.

Reuters contributed to this report.",right
